Column,translation,Question,year
StackOverflowBetter,SO 对网络贡献,Stack Overflow makes the Internet a better place,2017
StackOverflowWhatDo,没有SO将不知所措,I don't know what I'd do without Stack Overflow,2017
StackOverflowMakeMoney,SO只为钱,The people who run Stack Overflow are just in it for the money,2017
Gender,性别,Which of the following do you currently identify as?,2017
HighestEducationParents,父母收到的最高教育程度,What is the highest level of education received by either of your parents?,2017
Race,人种描述,Which of the following do you identify as?,2017
SurveyLong,调查太长,This survey was too long,2017
QuestionsInteresting,调查描述,The questions were interesting,2017
QuestionsConfusing,调查描述,The questions were confusing,2017
InterestedAnswers,对其他开发者学习的回答感兴趣,I'm interested in learning how other developers answered,2017
Salary,薪资,"What is your current annual base salary, before taxes, and excluding bonuses, grants, or other compensation?",2017
ExpectedSalary,毕业后期望年薪,"You said before that you are currently learning how to program. When you have completed your studies, what annual salary do you expect to earn in your first job after graduation?",2017
